[
  {
    "country_code": "ABW",
    "country_name": "Aruba",
    "data_type": "PDF Bulletin",
    "source_url": "https://www.cbaruba.org/document/monthly-tables-2026/",
    "update_frequency": "Monthly",
    "requires_js": true,
    "notes": "Home>Monthly Tables>연도별 페이지에서 최신 월 PDF Download 클릭 필요(연도별 페이지 목록형)",
    "adapter": {
      "implemented": true,
      "strategy_class": "PdfBulletinStrategy",
      "status": "success",
      "notes": "Monthly Bulletin PDF, TABLE 2: COMPONENTS OF BROAD MONEY. FCD=col(5)+col(9)+col(11), TD=col(6)+col(12). 연도별 아카이브(/document/monthly-tables-{YYYY}/)를 2010~현재까지 순회하며 각 연도의 롤링 윈도우(약 18개월+과거4개년 연간)를 병합해 장기 시계열을 재구성. 일부 PDF는 텍스트가 글자 단위로 뒤집혀 추출되는 손상본이라(2010,2011,2013,2014년 다수, 2018/2021 일부월) 해당 연도는 같은 해 다른 달로 자동 재시도하며, 그래도 실패하면 스킵 -> 2013년만 월별 데이터 공백, 나머지는 2011-01~최신월까지 커버 2010/2011/2013/2014년(및 일부 손상월)은 표준 OCR 폴백(README 참고)으로 추가 복구 시도, 완전 손상 연도는 여전히 일부 공백."
    }
  },
  {
    "country_code": "AFG",
    "country_name": "Afghanistan",
    "data_type": "PDF Bulletin",
    "source_url": "https://dab.gov.af/quarterly-economic-and-statistical-bulletins",
    "update_frequency": "Quarterly",
    "requires_js": false,
    "notes": "Statistics>Quarterly Economic and Statistical Bulletins, 외화예금(Foreign currency deposits) 수치 포함 분기 보고서",
    "adapter": {
      "implemented": true,
      "strategy_class": "PdfBulletinStrategy",
      "status": "success",
      "notes": "Annual/Quarterly Bulletin 랜딩 페이지에서 PDF 전부 수집(파일명에서 분기/연도 라벨 추출, 아프간력<1500이면 +621로 그레고리력 환산), 각 PDF의 'Table 2.1'류 표에서 'In Foreign currency'(Other Deposits/Quasi Money의 외화분) 행의 최신(가장 오른쪽) 열 값 추출. 35개 중 26개 성공(2006~2020, Q 단위), 9개는 해당 연도 표 포맷이 달라 행 자체가 없어 스킵. 사이트 마지막 게시물이 2021-01(FY1399 Q3)이라 최신 데이터는 아님"
    }
  },
  {
    "country_code": "AGO",
    "country_name": "Angola",
    "data_type": "Direct Excel",
    "source_url": "https://www.bna.ao/#/pt/estatisticas/estatisticas-monetarias-financeiras/nova-serie",
    "update_frequency": "Monthly",
    "requires_js": true,
    "notes": "사이트 인증서 오류로 자동접근 불가. 검색결과에 따르면 '통계>Estatisticas Monetarias e Financeiras' 메뉴에서 EMF Nova Serie 엑셀파일 제공 확인(bancobai 자료 인용)",
    "adapter": {
      "implemented": true,
      "strategy_class": "DirectExcelStrategy",
      "status": "success",
      "notes": "'Nova Série' 통계 페이지에서 'Agregados Monetários' 클릭(JS 다운로드, Playwright 필요) -> legacy .xls, 시트 'IA2.AggrMon'(Quadro I.A.2). indicator=foreign_currency_deposits: row25 'Total dos depósitos em moeda externa'(메모 항목 공식 합계). indicator=TD: row12 'Depósitos transferíveis'+row17 'Outros depósitos'(각 총액 행). 2012-01~2026-06, 161개월. bna.ao 응답이 간헐적으로 느려 자체 재시도(최대 3회) 포함"
    }
  },
  {
    "country_code": "AIA",
    "country_name": "Anguilla",
    "data_type": "Interactive Web",
    "source_url": "https://www.eccb-centralbank.org/statistics-category/monetary-and-financial-statistics/summarized-monetary-survey/a",
    "update_frequency": "Annual",
    "requires_js": true,
    "notes": "Statistics>Monetary and Financial Sector>Summarized Monetary Survey, Country=Anguilla 선택 후 Foreign Currency Deposits 항목 확인, Download 버튼으로 Excel 추출 가능",
    "adapter": {
      "implemented": true,
      "strategy_class": "InteractiveWebStrategy",
      "status": "success",
      "notes": "제시된 SDMX REST API(sdmx.eccb-centralbank.org)는 DNS 미해석(존재하지 않는 도메인)으로 확인됨 -> 실제로는 eccb-centralbank.org의 'Interactive Database' 쿼리 폼(Laravel, CSRF+암호화 hidden 필드, 부트스트랩 모달 안 select2 멀티셀렉트)이 진짜 데이터 소스. Playwright로 모달 열기-> 국가 선택->'Foreign Currency Deposits' 지표 선택->제출 흐름 재현(src/parsers/_eccb_common.py 공용). start_date를 jQuery datepicker API로 2000-01-01로 설정해 2000~2025년(26개년) 연간 데이터 확보. 8개국(AIA/ATG/DMA/GRD/MSR/KNA/LCA/VCT) 공용 로직 검증 완료"
    }
  },
  {
    "country_code": "ALA",
    "country_name": "Åland Islands",
    "data_type": "No Standalone Source",
    "source_url": null,
    "update_frequency": null,
    "requires_js": null,
    "notes": "해당 지역(올란드 제도)은 독립 중앙은행이 없으며 핀란드/ECB 통계에 포함됨. Source URL 없음",
    "adapter": {
      "implemented": false,
      "strategy_class": null,
      "status": "not_applicable",
      "notes": "data_type=No Standalone Source, 확인된 개별 통계 소스 없음 -> 수집 대상 아님(NoSourceStrategy)"
    }
  },
  {
    "country_code": "ALB",
    "country_name": "Albania",
    "data_type": "Interactive Web",
    "source_url": "https://www.bankofalbania.org/Statistics/Monetary_Financial_and_Banking_statistics/Sectoral_balance_sheet_of_banks.html",
    "update_frequency": "Monthly",
    "requires_js": true,
    "notes": "Monetary,Financial and Banking statistics>Deposits>\"Foreign currency deposits converted in ALL by sector and maturity\"(cregtab_id=741) 클릭 후 Show values로 테이블 조회, 별도 엑셀다운로드 버튼 없음(웹 테이블만 제공)",
    "adapter": {
      "implemented": true,
      "strategy_class": "InteractiveWebStrategy",
      "status": "success",
      "notes": "'Sectoral balance sheet of Deposit money banks' 페이지. 체크박스 트리에서 2.1.1.2(Transferable deposits In FC, id=85581) + 2.1.2.2(Other deposits In FC, id=85601) 선택 -> 'Show values' 2단계 클릭(1차: 기간선택 UI 노출, From을 최초월로 설정 -> 2차: 결과가 새 탭(?mode=alone)으로 열림) -> 두 항목 합산이 FCD. 2006-12~2026-06, 235개월 확보"
    }
  },
  {
    "country_code": "AND",
    "country_name": "Andorra",
    "data_type": "No Standalone Source",
    "source_url": null,
    "update_frequency": null,
    "requires_js": null,
    "notes": "안도라는 자체 중앙은행 없음(INAF가 유사기능). 공개된 시계열 통계 페이지 확인 안됨, Source URL 없음",
    "adapter": {
      "implemented": false,
      "strategy_class": null,
      "status": "not_applicable",
      "notes": "data_type=No Standalone Source, 확인된 개별 통계 소스 없음 -> 수집 대상 아님(NoSourceStrategy)"
    }
  },
  {
    "country_code": "ARE",
    "country_name": "United Arab Emirates (the)",
    "data_type": "PDF Bulletin",
    "source_url": "https://www.centralbank.ae/media/r0mirede/statistical-bulletin-may-2026.pdf",
    "update_frequency": "Monthly",
    "requires_js": true,
    "notes": "Research and Statistics>Statistics by Theme>\"Statistical Bulletin-Banking & Monetary Statistics\">월별 항목 클릭 후 상세페이지에서 PDF Download",
    "adapter": {
      "implemented": true,
      "strategy_class": "PdfBulletinStrategy",
      "status": "success",
      "notes": "Statistical Bulletin PDF, Table 2 Monetary Survey, 'Foreign Currency Deposits' 행을 월별 헤더와 매칭, PDF당 ~13개월 롤링. 목록 페이지는 requests에 403(CF)이지만 Playwright로는 통과됨을 확인해 /en/research-and-statistics/latest-statistics/ 페이지에서 최신 호를 자동 발견하도록 추가(2026-08-19) + 2025-08/09/12 등 빠졌던 호 시드 보강. 2026-08-19 버그 수정: 'Table 3: Monthly Changes in Factors Affecting Money Supply'가 Table 2와 똑같은 행 라벨(Foreign Currency Deposits 등)을 쓰지만 값은 전월대비 증감(음수 가능)이라, 파서가 두 표를 구분 못 해 증감값이 재고값을 덮어써 음수 FCD/TD/ratio가 들어가고 있었음 — 'monthly changes' 페이지를 건너뛰도록 수정. 잔여 이슈: 2025-07/08 두 기간은 여전히 음수로 나와 DB 값범위 검증(supabase_store._validate_value_range)에서 자동 드롭됨(원인 미해결, 아마 다른 표 겹침 케이스) — 그 두 달은 FCD/ratio 없이 TD만 있을 수 있음. 2026-08-19 추가: 2008~2013년판 Annual Report의 'TABLE (A-4): MONETARY SURVEY' 부록(연 1~2개 데이터포인트)을 추가 소스로 병합 — 2018년 이전 이력 확장(2009,2010,2011,2012,2013-Annual). 개선 후 실측 59기간(2009-Annual~2026-06)."
    }
  },
  {
    "country_code": "ARG",
    "country_name": "Argentina",
    "data_type": "API",
    "source_url": "https://api.bcra.gob.ar/estadisticas/v4.0/Monetarias/1414",
    "update_frequency": "Monthly",
    "requires_js": false,
    "notes": "Boletín Estadístico(월간) 목록에서 최신월 클릭 시 PDF 내 Excel(.xls) 시리즈 링크 포함, 예: dep....xls 형태로 개별 시리즈 다운 가능",
    "adapter": {
      "implemented": true,
      "strategy_class": "ApiStrategy",
      "status": "success",
      "notes": "제시된 idVariable=14는 실제로 'Tasa de interés de préstamos personales'(개인대출 금리)였음 -> 전체 변수 목록(/v4.0/Monetarias)에서 descripcion 검색으로 idVariable=1414('Depósitos totales del total de sectores', 카테고리='Depósitos por cuenta', 단위=USD백만)를 정확한 지표로 특정. API도 v3.0은 이미 폐기(HTTP 410)되어 v4.0 사용. 일별 데이터를 월말값 기준 월별 집계, offset 페이지네이션(limit=3000). 1999-12~2026-08, 321개월 확보"
    }
  },
  {
    "country_code": "ARM",
    "country_name": "Armenia",
    "data_type": "Interactive Web",
    "source_url": "https://www.cba.am/en/statistics/monetary-aggregates/50",
    "update_frequency": "Monthly",
    "requires_js": false,
    "notes": "Statistics>Deposits>Commercial banks deposits by sectors; interactive filterable table by sector/currency, no direct file download",
    "adapter": {
      "implemented": true,
      "strategy_class": "InteractiveWebStrategy",
      "status": "success",
      "notes": "Monetary Aggregates 페이지의 'Export all' 링크(/50/export-all/)가 실제로는 JSON이 아니라 XLSX를 반환(단일 GET, Playwright 불필요). 시트 'value, month': col3 Demand deposits in drams + col5 Time deposits in drams + col7 Deposits in foreign currency(=FCD) = TD. 2003-01~2026-06, 282개월 x 2지표 = 564행"
    }
  },
  {
    "country_code": "ASM",
    "country_name": "American Samoa",
    "data_type": "No Standalone Source",
    "source_url": null,
    "update_frequency": null,
    "requires_js": null,
    "notes": "No central bank; uses US Federal Reserve System. No standalone monetary statistics source found for American Samoa",
    "adapter": {
      "implemented": false,
      "strategy_class": null,
      "status": "not_applicable",
      "notes": "data_type=No Standalone Source, 확인된 개별 통계 소스 없음 -> 수집 대상 아님(NoSourceStrategy)"
    }
  },
  {
    "country_code": "ATA",
    "country_name": "Antarctica",
    "data_type": "No Standalone Source",
    "source_url": null,
    "update_frequency": null,
    "requires_js": null,
    "notes": "No central bank; Antarctica has no permanent population or banking system",
    "adapter": {
      "implemented": false,
      "strategy_class": null,
      "status": "not_applicable",
      "notes": "data_type=No Standalone Source, 확인된 개별 통계 소스 없음 -> 수집 대상 아님(NoSourceStrategy)"
    }
  },
  {
    "country_code": "ATF",
    "country_name": "French Southern Territories (the)",
    "data_type": "No Standalone Source",
    "source_url": null,
    "update_frequency": null,
    "requires_js": null,
    "notes": "No central bank; French Southern Territories administered by France, uses French/EU statistics",
    "adapter": {